{
  "id": "while-loops",
  "title": "While Loops",
  "category": "control-flow",
  "difficulty": "beginner",
  "order": 3,
  "description": "Learn to repeat code while a condition is true using while loops",
  "estimatedTime": 20,
  "tags": ["while", "loop", "iteration", "repetition", "control-flow"],
  "content": {
    "introduction": "Often in programming, you need to repeat the same actions multiple times. Loops allow you to execute code repeatedly without writing it over and over.\n\nThe `while` loop is the most basic type of loop - it continues executing as long as a condition remains true.\n\n### What You'll Learn\n- Basic while loop syntax\n- Loop counters and conditions\n- Infinite loops and how to avoid them\n- Accumulation patterns\n- Nested while loops",
    "concepts": [
      {
        "title": "While Loop",
        "description": "Repeats a block of code as long as the condition is true: while condition do statement"
      },
      {
        "title": "Loop Counter",
        "description": "A variable that tracks how many times the loop has executed"
      },
      {
        "title": "Infinite Loop",
        "description": "A loop that never stops because its condition never becomes false - usually a bug!"
      },
      {
        "title": "Loop Accumulator",
        "description": "A variable that accumulates values during loop iterations (e.g., a running total)"
      }
    ],
    "examples": [
      {
        "title": "Basic While Loop",
        "description": "Count from 1 to 5 using a while loop",
        "code": "program BasicWhile;\n\nvar\n  count: Integer;\n\nbegin\n  count := 1;\n  \n  while count <= 5 do\n  begin\n    WriteLn('Count: ', count);\n    count := count + 1;\n  end;\n  \n  WriteLn('Done!');\nend.",
        "expectedOutput": "Count: 1\nCount: 2\nCount: 3\nCount: 4\nCount: 5\nDone!"
      },
      {
        "title": "Countdown Loop",
        "description": "Count backwards from 10 to 1",
        "code": "program Countdown;\n\nvar\n  num: Integer;\n\nbegin\n  num := 10;\n  \n  while num > 0 do\n  begin\n    WriteLn(num);\n    num := num - 1;\n  end;\n  \n  WriteLn('Blastoff!');\nend.",
        "expectedOutput": "10\n9\n8\n7\n6\n5\n4\n3\n2\n1\nBlastoff!"
      },
      {
        "title": "Sum Accumulator",
        "description": "Calculate the sum of numbers from 1 to 10",
        "code": "program SumNumbers;\n\nvar\n  num: Integer;\n  sum: Integer;\n\nbegin\n  num := 1;\n  sum := 0;\n  \n  while num <= 10 do\n  begin\n    sum := sum + num;\n    num := num + 1;\n  end;\n  \n  WriteLn('Sum of 1 to 10 is: ', sum);\nend.",
        "expectedOutput": "Sum of 1 to 10 is: 55"
      },
      {
        "title": "Input Validation",
        "description": "Keep asking for input until valid",
        "code": "program InputValidation;\n\nvar\n  input: String;\n  age: Integer;\n  valid: Boolean;\n\nbegin\n  valid := False;\n  \n  while not valid do\n  begin\n    WriteLn('Enter your age (18-100):');\n    ReadLn(input);\n    age := StrToInt(input);\n    \n    if (age >= 18) and (age <= 100) then\n      valid := True\n    else\n      WriteLn('Invalid age! Try again.');\n  end;\n  \n  WriteLn('Thank you! Your age is ', age);\nend.",
        "expectedOutput": "Enter your age (18-100):\n[User enters: 15]\nInvalid age! Try again.\nEnter your age (18-100):\n[User enters: 25]\nThank you! Your age is 25"
      },
      {
        "title": "Power Calculation",
        "description": "Calculate 2^n using a while loop",
        "code": "program PowerOfTwo;\n\nvar\n  n: Integer;\n  count: Integer;\n  result: Integer;\n\nbegin\n  n := 5;  // Calculate 2^5\n  count := 0;\n  result := 1;\n  \n  while count < n do\n  begin\n    result := result * 2;\n    count := count + 1;\n  end;\n  \n  WriteLn('2^', n, ' = ', result);\nend.",
        "expectedOutput": "2^5 = 32"
      },
      {
        "title": "Nested While Loops",
        "description": "Use one while loop inside another to create a pattern",
        "code": "program NestedWhile;\n\nvar\n  row, col: Integer;\n\nbegin\n  row := 1;\n  \n  while row <= 3 do\n  begin\n    col := 1;\n    while col <= 5 do\n    begin\n      Write('* ');\n      col := col + 1;\n    end;\n    WriteLn('');\n    row := row + 1;\n  end;\nend.",
        "expectedOutput": "* * * * * \n* * * * * \n* * * * * "
      }
    ],
    "exercises": [
      {
        "title": "Multiplication Table",
        "description": "Write a program that displays the multiplication table for 7 (7x1 through 7x10) using a while loop.",
        "starterCode": "program MultiplicationTable;\n\nvar\n  // Declare your variables here\n\nbegin\n  WriteLn('Multiplication table for 7:');\n  // Your code here\n  \nend.",
        "solution": "program MultiplicationTable;\n\nvar\n  i: Integer;\n\nbegin\n  WriteLn('Multiplication table for 7:');\n  i := 1;\n  \n  while i <= 10 do\n  begin\n    WriteLn('7 x ', i, ' = ', 7 * i);\n    i := i + 1;\n  end;\nend.",
        "hints": [
          "Create a counter variable starting at 1",
          "Loop while counter <= 10",
          "Multiply 7 by the counter in each iteration",
          "Don't forget to increment the counter!"
        ]
      },
      {
        "title": "Factorial Calculator",
        "description": "Calculate the factorial of a number (e.g., 5! = 5 * 4 * 3 * 2 * 1 = 120). Use a while loop.",
        "starterCode": "program Factorial;\n\nvar\n  n: Integer;\n  // Declare more variables as needed\n\nbegin\n  n := 5;\n  // Your code here\n  \n  WriteLn('Factorial of ', n, ' is: ', result);\nend.",
        "solution": "program Factorial;\n\nvar\n  n: Integer;\n  result: Integer;\n  count: Integer;\n\nbegin\n  n := 5;\n  result := 1;\n  count := n;\n  \n  while count > 0 do\n  begin\n    result := result * count;\n    count := count - 1;\n  end;\n  \n  WriteLn('Factorial of ', n, ' is: ', result);\nend.",
        "hints": [
          "Start result at 1 (not 0!)",
          "Create a counter starting at n",
          "Multiply result by counter each iteration",
          "Decrement counter each time",
          "Loop while counter > 0"
        ]
      },
      {
        "title": "Number Guessing Game",
        "description": "Create a simple number guessing game. The secret number is 42. Keep asking until the user guesses correctly, giving 'too high' or 'too low' hints.",
        "starterCode": "program GuessingGame;\n\nvar\n  secret: Integer;\n  // Declare more variables\n\nbegin\n  secret := 42;\n  WriteLn('Guess the number (1-100):');\n  // Your code here\n  \nend.",
        "solution": "program GuessingGame;\n\nvar\n  secret: Integer;\n  guess: Integer;\n  guessStr: String;\n  found: Boolean;\n\nbegin\n  secret := 42;\n  found := False;\n  \n  WriteLn('Guess the number (1-100):');\n  \n  while not found do\n  begin\n    ReadLn(guessStr);\n    guess := StrToInt(guessStr);\n    \n    if guess = secret then\n    begin\n      WriteLn('Correct! The number was ', secret);\n      found := True;\n    end\n    else if guess < secret then\n      WriteLn('Too low! Try again:')\n    else\n      WriteLn('Too high! Try again:');\n  end;\nend.",
        "hints": [
          "Use a boolean variable to track if the number is found",
          "Loop while not found",
          "Read the user's guess inside the loop",
          "Compare guess to secret number",
          "Set found to True when guess matches"
        ]
      },
      {
        "title": "Sum of Even Numbers",
        "description": "Calculate the sum of all even numbers from 2 to 20 using a while loop.",
        "starterCode": "program SumEven;\n\nvar\n  // Declare your variables here\n\nbegin\n  // Your code here\n  \n  WriteLn('Sum of even numbers 2-20: ', sum);\nend.",
        "solution": "program SumEven;\n\nvar\n  num: Integer;\n  sum: Integer;\n\nbegin\n  num := 2;\n  sum := 0;\n  \n  while num <= 20 do\n  begin\n    sum := sum + num;\n    num := num + 2;  // Skip to next even number\n  end;\n  \n  WriteLn('Sum of even numbers 2-20: ', sum);\nend.",
        "hints": [
          "Start num at 2 (first even number)",
          "Initialize sum to 0",
          "Add num to sum each iteration",
          "Increment num by 2 (to get next even number)",
          "Loop while num <= 20"
        ]
      }
    ],
    "summary": "Excellent work! You've learned:\n\n- **While loop syntax**: Repeating code while a condition is true\n- **Loop counters**: Tracking iterations with a variable\n- **Accumulators**: Building up values across iterations\n- **Loop conditions**: Making sure loops eventually stop\n- **Nested loops**: Loops within loops for complex patterns\n\nWhile loops are powerful tools for repetition when you don't know in advance how many times to loop!",
    "nextSteps": "Next, you'll learn about **for loops** - a more convenient way to loop when you know exactly how many times you want to repeat something!"
  },
  "prerequisites": ["if-statements", "operators-and-expressions"],
  "relatedLessons": ["for-loops", "repeat-until-loops"],
  "estimatedTime": 20
}
